timeline_title,timeline_slug,category,event_count,last_updated
Timeline of the Evolution of the Map,evolution-of-the-map,science,24,2026-03-15 19:14:07.781697+00
Timeline of Piracy,piracy,war,23,2026-03-15 19:14:07.781697+00
Timeline of the Migration of Grains,migration-of-grains,history,23,2026-03-15 19:14:07.781697+00
Timeline of Quarantine,quarantine,society,24,2026-03-15 19:14:07.781697+00
Timeline of Silk and Sericulture,silk-and-sericulture,culture,24,2026-03-15 19:14:07.781697+00
Timeline of Salt,salt,history,23,2026-03-15 19:14:07.781697+00
Timeline of Privacy Rights,privacy-rights,politics,22,2026-03-15 12:40:52.973076+00
Timeline of Aluminum,aluminum,industry,21,2026-03-15 12:40:52.973076+00
Timeline of the Age of Blue,age-of-blue,culture,20,2026-03-15 12:40:52.973076+00
Timeline of Atomic Theory,atomic-theory,science,21,2026-03-15 12:40:52.973076+00
Timeline of the Idea of the Future,idea-of-the-future,culture,21,2026-03-15 12:40:52.973076+00
Timeline of the Shape of the Earth,shape-of-the-earth,science,20,2026-03-15 12:40:52.973076+00
Timeline of the History of Silence,history-of-silence,society,21,2026-03-15 12:40:52.973076+00
Timeline of the Evolution of Sweetness,evolution-of-sweetness,culture,21,2026-03-15 12:40:52.973076+00
Timeline of the Velocity of Information,velocity-of-information,technology,23,2026-03-15 12:40:52.973076+00
Timeline of Artificial Light,artificial-light,technology,21,2026-03-15 12:40:52.973076+00
Timeline of the Silk Road,silk-road,history,20,2026-03-15 11:29:51.71416+00
Timeline of Pan-Africanism,pan-africanism,politics,20,2026-03-15 11:29:51.71416+00
Timeline of the Indian Independence Movement,indian-independence-movement,history,20,2026-03-15 11:29:51.71416+00
Timeline of the Meiji Restoration and Modern Japan,meiji-restoration-modern-japan,history,20,2026-03-15 11:29:51.71416+00
Timeline of the Inca Empire,inca-empire,history,20,2026-03-15 11:29:51.71416+00
Timeline of the Aztec Empire,aztec-empire,history,20,2026-03-15 11:29:51.71416+00
Timeline of the Delhi Sultanate,delhi-sultanate,history,20,2026-03-15 11:29:51.71416+00
Timeline of the Qing Dynasty,qing-dynasty,history,20,2026-03-15 11:29:51.71416+00
Timeline of the Ottoman Empire,ottoman-empire,history,20,2026-03-15 11:29:51.71416+00
Timeline of the Mali Empire,mali-empire,history,40,2026-03-15 11:29:51.71416+00
History of BlackRock,blackrock,finance,20,2026-03-15 07:39:40.318922+00
History of Saudi Aramco,saudi-aramco,finance,20,2026-03-15 07:39:40.318922+00
History of Tencent,tencent,technology,20,2026-03-15 07:39:40.318922+00
History of Alibaba Group,alibaba-group,finance,20,2026-03-15 07:39:40.318922+00
History of Intel,intel,technology,20,2026-03-15 07:39:40.318922+00
History of IBM,ibm,technology,20,2026-03-15 07:39:40.318922+00
History of Toyota,toyota,industry,20,2026-03-15 07:39:40.318922+00
History of Samsung,samsung,technology,20,2026-03-15 07:39:40.318922+00
History of Netflix,netflix,culture,20,2026-03-15 07:39:40.318922+00
History of SpaceX,spacex,technology,20,2026-03-15 07:39:40.318922+00
Timeline of the Red Cross and Red Crescent Movement,red-cross-and-red-crescent-movement,society,20,2026-03-14 21:21:37.108002+00
Timeline of the Nobel Prize,nobel-prize,culture,20,2026-03-14 21:21:37.108002+00
Timeline of the Postal System,postal-system,society,20,2026-03-14 21:21:37.108002+00
Timeline of the History of Museums,history-of-museums,culture,20,2026-03-14 21:21:37.108002+00
Timeline of Antibiotics,antibiotics,science,20,2026-03-14 21:21:37.108002+00
Timeline of Ocean Conservation,ocean-conservation,environment,20,2026-03-14 21:21:37.108002+00
Timeline of the History of Democracy,democracy-global-history,politics,20,2026-03-14 21:21:37.108002+00
Timeline of the Paralympic Movement,paralympic-movement,sports,20,2026-03-14 21:21:37.108002+00
Timeline of Pencils,pencils,technology,20,2026-03-14 21:21:37.108002+00
Timeline of Kissing,kissing,society,20,2026-03-14 21:21:37.108002+00
Timeline of FIFA World Cup,fifa-world-cup,sport,20,2026-03-14 19:48:55.159691+00
Timeline of Pandemics,pandemics,science,20,2026-03-14 19:48:55.159691+00
Timeline of Financial Crashes,financial-crashes,finance,20,2026-03-14 19:48:55.159691+00
Timeline of Decolonization,decolonization,politics,20,2026-03-14 19:48:55.159691+00
Timeline of Lost Cities Rediscovered,lost-cities-rediscovered,history,20,2026-03-14 19:48:55.159691+00
Timeline of Famous Assassinations,famous-assassinations,history,20,2026-03-14 19:48:55.159691+00
Timeline of Human Extinction Scares,human-extinction-scares,society,20,2026-03-14 19:48:55.159691+00
History of Democracy,history-of-democracy,politics,40,2026-03-14 19:48:55.159691+00
History of the Internet,history-of-the-internet,technology,40,2026-03-14 19:48:55.159691+00
History of Tea,history-of-tea,culture,40,2026-03-14 19:48:55.159691+00
Timeline of the Civil Rights Movement in the United States,civil-rights-movement-united-states,society,20,2026-03-14 13:11:26.789253+00
Timeline of Famous Historical Hoaxes,famous-historical-hoaxes,culture,20,2026-03-14 13:11:26.789253+00
Timeline of Artificial Intelligence,artificial-intelligence,technology,20,2026-03-14 13:11:26.789253+00
Timeline of the French Revolution,french-revolution,history,20,2026-03-14 13:11:26.789253+00
Timeline of the Kingdom of Aksum,kingdom-of-aksum,history,20,2026-03-14 13:11:26.789253+00
Timeline of the Great Emu War,great-emu-war,history,20,2026-03-14 13:11:26.789253+00
Timeline of Quantum Mechanics,quantum-mechanics,science,40,2026-03-14 13:11:26.789253+00
Timeline of the Space Race,space-race,science,41,2026-03-14 13:11:26.789253+00
Timeline of the Cold War,cold-war,politics,43,2026-03-14 13:11:26.789253+00
Timeline of Detective Fiction,detective-fiction,literature,20,2026-03-14 11:26:02.836803+00
Timeline of the Great Migration in the United States,great-migration-united-states,society,20,2026-03-14 11:26:02.836803+00
Timeline of LGBTQ+ Rights,lgbtq-rights,society,20,2026-03-14 11:26:02.836803+00
Timeline of the History of the Telephone,history-of-the-telephone,technology,20,2026-03-14 11:26:02.836803+00
Timeline of NATO,nato,politics,20,2026-03-14 11:26:02.836803+00
Timeline of the Thirty Years' War,thirty-years-war,war,20,2026-03-14 11:26:02.836803+00
Timeline of Buddhism,buddhism,religion,20,2026-03-14 11:26:02.836803+00
Timeline of the Mongol Empire,mongol-empire,history,20,2026-03-14 11:26:02.836803+00
Timeline of the History of Comics,history-of-comics,culture,20,2026-03-14 11:04:13.374717+00
Timeline of Public Health,public-health,health,20,2026-03-14 11:04:13.374717+00
Timeline of the History of Advertising,history-of-advertising,culture,20,2026-03-14 11:04:13.374717+00
Timeline of Ancient Mesopotamia,ancient-mesopotamia,history,20,2026-03-14 11:04:13.374717+00
Timeline of United States Presidential Elections,united-states-presidential-elections,politics,20,2026-03-14 11:04:13.374717+00
Timeline of the Bretton Woods System,bretton-woods-system,finance,20,2026-03-14 11:04:13.374717+00
Timeline of Robotics,robotics,technology,20,2026-03-14 11:04:13.374717+00
Timeline of the Labor Movement,labor-movement,society,20,2026-03-14 11:04:13.374717+00
Timeline of the Theory of Evolution,theory-of-evolution,science,20,2026-03-14 11:04:13.374717+00
Timeline of the History of Railways,history-of-railways,technology,20,2026-03-14 11:04:13.374717+00
Timeline of the Supreme Court of the United States,supreme-court-of-the-united-states,law,20,2026-03-14 09:56:31.01157+00
Timeline of the History of Forensic Science,history-of-forensic-science,science,20,2026-03-14 09:56:31.01157+00
Timeline of Disability Rights,disability-rights,society,20,2026-03-14 09:56:31.01157+00
Timeline of the History of Cryptography,history-of-cryptography,science,20,2026-03-14 09:56:31.01157+00
Timeline of the History of Fashion,history-of-fashion,culture,21,2026-03-14 09:56:31.01157+00
Timeline of the History of Video Games,history-of-video-games,technology,21,2026-03-14 09:56:31.01157+00
Timeline of the Suez Canal and Global Shipping,suez-canal-and-global-shipping,trade,20,2026-03-14 09:56:31.01157+00
Timeline of the Titanic Disaster and Legacy,titanic-disaster-and-legacy,disaster,21,2026-03-14 09:56:31.01157+00
Timeline of the Maya Civilization,maya-civilization,history,23,2026-03-14 09:56:31.01157+00
Timeline of the Papacy and the Vatican,papacy-and-vatican,religion,23,2026-03-14 09:56:31.01157+00
Timeline of the History of Espionage,history-of-espionage,war,21,2026-03-14 09:13:23.086296+00
Timeline of the History of Stock Markets,history-of-stock-markets,finance,21,2026-03-14 09:13:23.086296+00
Timeline of the History of Journalism,history-of-journalism,media,21,2026-03-14 09:13:23.086296+00
Timeline of the History of Social Media,history-of-social-media,technology,20,2026-03-14 09:13:23.086296+00
Timeline of the History of Global Cinema,history-of-global-cinema,culture,20,2026-03-14 09:13:23.086296+00
Timeline of the History of Cities,history-of-cities,history,20,2026-03-14 09:13:23.086296+00
Timeline of the History of Education,history-of-education,society,21,2026-03-14 09:13:23.086296+00
Timeline of the History of Migration,history-of-migration,society,21,2026-03-14 09:13:23.086296+00
Timeline of Slavery and Abolition,slavery-and-abolition,society,22,2026-03-14 09:13:23.086296+00
Timeline of the History of Human Rights,history-of-human-rights,politics,21,2026-03-14 09:13:23.086296+00
Timeline of the History of Writing Systems,history-of-writing-systems,culture,20,2026-03-14 08:34:44.785297+00
Timeline of the History of Newspapers,history-of-newspapers,media,20,2026-03-14 08:34:44.785297+00
Timeline of Literary Movements,literary-movements,literature,20,2026-03-14 08:34:44.785297+00
Timeline of Modern Poetry,modern-poetry,literature,20,2026-03-14 08:34:44.785297+00
Timeline of the History of Philosophy,history-of-philosophy,philosophy,20,2026-03-14 08:34:44.785297+00
Timeline of the History of Book Publishing,history-of-book-publishing,culture,20,2026-03-14 08:34:44.785297+00
Timeline of the History of Censorship,history-of-censorship,politics,20,2026-03-14 08:34:44.785297+00
Timeline of the History of Libraries,history-of-libraries,society,20,2026-03-14 08:34:44.785297+00
Timeline of the History of Translation,history-of-translation,literature,20,2026-03-14 08:34:44.785297+00
Timeline of Arabic Literature,arabic-literature,literature,20,2026-03-14 08:34:44.785297+00
Timeline of Impressionism,impressionism,culture,21,2026-03-13 23:20:12.876065+00
Timeline of the East India Company,east-india-company,finance,22,2026-03-13 23:20:12.876065+00
Timeline of CRISPR Gene Editing,crispr-gene-editing,technology,21,2026-03-13 23:20:12.876065+00
Timeline of the Chernobyl Disaster and Aftermath,chernobyl-disaster-and-aftermath,science,22,2026-03-13 23:20:12.876065+00
Timeline of the Watergate Scandal,watergate-scandal,politics,24,2026-03-13 23:20:12.876065+00
Timeline of the Partition of India,partition-of-india,politics,22,2026-03-13 23:20:12.876065+00
Timeline of the Norman Conquest of England,norman-conquest-of-england,history,22,2026-03-13 23:20:12.876065+00
Timeline of Global Financial Crises,global-financial-crises,finance,24,2026-03-13 22:57:58.010337+00
Timeline of the Printing Press and Print Culture,printing-press-and-print-culture,culture,21,2026-03-13 22:57:58.010337+00
Timeline of the Roman Empire,roman-empire,history,24,2026-03-13 22:57:58.010337+00
Timeline of the Women's Suffrage Movement,womens-suffrage-movement,society,23,2026-03-13 22:57:58.010337+00
Timeline of the Industrial Revolution,industrial-revolution,technology,21,2026-03-13 22:57:58.010337+00
Timeline of Ancient Egypt,ancient-egypt,history,24,2026-03-13 22:57:58.010337+00
Timeline of the Ming Dynasty,ming-dynasty,history,25,2026-03-13 22:57:58.010337+00
History of Vaccination,history-of-vaccination,science,43,2026-03-13 22:57:58.010337+00
Timeline of the History of Psychology,history-of-psychology,science,20,2026-03-13 21:55:42.364392+00
Timeline of the History of the Automobile,history-of-the-automobile,technology,20,2026-03-13 21:55:42.364392+00
Timeline of the Holocaust,holocaust,war,20,2026-03-13 21:55:42.364392+00
Timeline of the History of Mexico,history-of-mexico,history,20,2026-03-13 21:55:42.364392+00
Timeline of Semiconductor Development,semiconductor-development,technology,20,2026-03-13 21:55:42.364392+00
Timeline of the History of Medicine,history-of-medicine,science,12,2026-03-13 21:55:42.364392+00
Timeline of the Soviet Union,soviet-union,politics,20,2026-03-13 21:55:42.364392+00
Timeline of the Napoleonic Wars,napoleonic-wars,war,20,2026-03-13 21:55:42.364392+00
Timeline of Christianity,christianity,religion,20,2026-03-13 21:55:42.364392+00
Timeline of Ancient Greece,ancient-greece,history,20,2026-03-13 21:55:42.364392+00
Timeline of Mobile Phone Development,mobile-phone-development,technology,20,2026-03-13 15:27:44.415163+00
Timeline of the Global Age of Exploration,global-age-of-exploration,history,20,2026-03-13 15:27:44.415163+00
Timeline of Japanese Historical Development,japanese-historical-development,history,20,2026-03-13 15:27:44.415163+00
Timeline of South African Anti-Apartheid Struggle,south-african-anti-apartheid-struggle,society,20,2026-03-13 15:27:44.415163+00
Timeline of Television History Worldwide,television-history-worldwide,technology,20,2026-03-13 15:27:44.415163+00
Timeline of the Korean War Conflict,korean-war-conflict,war,20,2026-03-13 15:27:44.415163+00
Timeline of the American Revolutionary Era,american-revolutionary-era,politics,20,2026-03-13 15:27:44.415163+00
Timeline of Islamic Civilization History,islamic-civilization-history,religion,20,2026-03-13 15:27:44.415163+00
Timeline of Byzantine Imperial History,byzantine-imperial-history,history,20,2026-03-13 15:27:44.415163+00
Timeline of World War II Global Conflict,world-war-ii-global-conflict,war,20,2026-03-13 15:27:44.415163+00
Timeline of the Human Genome Project,timeline-of-the-human-genome-project,science,20,2026-03-13 13:45:27.681252+00
Timeline of Shakespeare and His Afterlife,timeline-of-shakespeare-and-his-afterlife,literature,20,2026-03-13 13:45:27.681252+00
Timeline of the HIV/AIDS Crisis,timeline-of-the-hiv-aids-crisis,society,20,2026-03-13 13:45:27.681252+00
Timeline of the History of Photography,timeline-of-the-history-of-photography,culture,20,2026-03-13 13:45:27.681252+00
Timeline of the History of Aviation,timeline-of-the-history-of-aviation,technology,20,2026-03-13 13:45:27.681252+00
Timeline of the United Nations,timeline-of-the-united-nations,politics,21,2026-03-13 13:45:27.681252+00
Timeline of the History of India,timeline-of-the-history-of-india,history,24,2026-03-13 13:45:27.681252+00
Timeline of the Vietnam War,timeline-of-the-vietnam-war,war,20,2026-03-13 13:45:27.681252+00
Timeline of the Renaissance,timeline-of-the-renaissance,culture,20,2026-03-13 13:45:27.681252+00
Timeline of Ancient Egypt,timeline-of-ancient-egypt,history,22,2026-03-13 13:45:27.681252+00
Timeline of the Environmental Movement,timeline-of-the-environmental-movement,society,20,2026-03-13 12:34:20.312506+00
Timeline of Bollywood Cinema,timeline-of-bollywood-cinema,culture,20,2026-03-13 12:34:20.312506+00
Timeline of Country Music,timeline-of-country-music,culture,20,2026-03-13 12:34:20.312506+00
Timeline of Electronic Dance Music,timeline-of-electronic-dance-music,culture,20,2026-03-13 12:34:20.312506+00
Timeline of Hip-Hop,timeline-of-hip-hop,culture,20,2026-03-13 12:34:20.312506+00
Timeline of Punk Rock,timeline-of-punk-rock,culture,20,2026-03-13 12:34:20.312506+00
Timeline of Reggae,timeline-of-reggae,culture,20,2026-03-13 12:34:20.312506+00
Timeline of Opera,timeline-of-opera,culture,20,2026-03-13 12:34:20.312506+00
Timeline of Flamenco,timeline-of-flamenco,culture,20,2026-03-13 12:34:20.312506+00
Timeline of Delta Blues,timeline-of-delta-blues,culture,20,2026-03-13 12:34:20.312506+00
Timeline of the Salt March,salt-march,politics,20,2026-03-13 09:48:25.618935+00
Timeline of the History of the Novel,timeline-of-the-history-of-the-novel,literature,20,2026-03-13 09:08:58.684552+00
Timeline of the Atomic Age,timeline-of-the-atomic-age,science,20,2026-03-13 09:08:58.684552+00
Timeline of the Women's Rights Movement,timeline-of-the-womens-rights-movement,society,20,2026-03-13 09:08:58.684552+00
Timeline of Jazz,timeline-of-jazz,culture,20,2026-03-13 09:08:58.684552+00
Timeline of the American Civil War,timeline-of-the-american-civil-war,war,20,2026-03-13 09:08:58.684552+00
Timeline of the History of China,timeline-of-the-history-of-china,history,20,2026-03-13 09:08:58.684552+00
Timeline of the Great Depression,timeline-of-the-great-depression,finance,20,2026-03-13 09:08:58.684552+00
Timeline of the Crusades,timeline-of-the-crusades,war,20,2026-03-13 09:08:58.684552+00
Timeline of the Scientific Revolution,timeline-of-the-scientific-revolution,science,20,2026-03-13 09:08:58.684552+00
Timeline of the Space Race,timeline-of-the-space-race,science,20,2026-03-13 09:08:58.684552+00
History of the Olympic Games,history-of-the-olympic-games,culture,20,2026-03-13 08:52:38.282949+00
Timeline of Women's Suffrage,timeline-of-womens-suffrage,society,20,2026-03-13 08:52:38.282949+00
Timeline of the Black Death,timeline-of-the-black-death,society,20,2026-03-13 08:52:38.282949+00
Timeline of the European Union,timeline-of-the-european-union,politics,20,2026-03-13 08:52:38.282949+00
History of the Silk Road,history-of-the-silk-road,history,20,2026-03-13 08:52:38.282949+00
Timeline of Artificial Intelligence,timeline-of-artificial-intelligence,technology,20,2026-03-13 08:52:38.282949+00
History of Bitcoin,history-of-bitcoin,finance,20,2026-03-13 08:52:38.282949+00
Timeline of the French Revolution,timeline-of-the-french-revolution,history,20,2026-03-13 08:52:38.282949+00
Timeline of the Roman Empire,timeline-of-the-roman-empire,history,20,2026-03-13 08:52:38.282949+00
Timeline of the Cold War,timeline-of-the-cold-war,politics,20,2026-03-13 08:52:38.282949+00
History of the Toilet,history-of-the-toilet,society,20,2026-03-13 07:20:54.084625+00
History of Self-Experimentation in Science,history-of-self-experimentation-in-science,science,20,2026-03-13 07:20:54.084625+00
Timeline of the Voynich Manuscript,timeline-of-the-voynich-manuscript,literature,20,2026-03-13 07:20:54.084625+00
History of Public Zoos,history-of-public-zoos,society,20,2026-03-13 07:20:54.084625+00
Timeline of the Dodo,timeline-of-the-dodo,science,20,2026-03-13 07:20:54.084625+00
History of Coffeehouses,history-of-coffeehouses,culture,20,2026-03-13 07:20:54.084625+00
History of Calendar Reform,history-of-calendar-reform,history,20,2026-03-13 07:20:54.084625+00
Timeline of Pirate Republics,timeline-of-pirate-republics,war,20,2026-03-13 07:20:54.084625+00
History of Micronations,history-of-micronations,society,20,2026-03-13 07:20:54.084625+00
History of the Fax Machine,history-of-the-fax-machine,technology,20,2026-03-13 07:20:54.084625+00
History of Navigation,history-of-navigation,science,20,2026-03-13 06:57:56.812301+00
History of Printing,history-of-printing,technology,20,2026-03-13 06:57:56.812301+00
History of the FIFA World Cup,history-of-the-fifa-world-cup,sports,20,2026-03-13 06:57:56.812301+00
History of the British Pound,history-of-the-british-pound,finance,20,2026-03-13 06:57:56.812301+00
History of Banking,history-of-banking,finance,20,2026-03-13 06:57:56.812301+00
History of Silver,history-of-silver,finance,20,2026-03-13 06:57:56.812301+00
Timeline of Civil Rights in the United States,timeline-of-civil-rights-in-the-united-states,society,22,2026-03-13 05:29:00.676999+00
Timeline of Computing,timeline-of-computing,technology,21,2026-03-13 05:29:00.676999+00
Timeline of Climate Change Science,timeline-of-climate-change-science,science,21,2026-03-13 05:29:00.676999+00
Timeline of Decolonization,timeline-of-decolonization,politics,23,2026-03-13 05:29:00.676999+00
Timeline of World War I,timeline-of-world-war-i,war,21,2026-03-13 05:29:00.676999+00
Timeline of the Protestant Reformation,timeline-of-the-protestant-reformation,religion,20,2026-03-13 05:29:00.676999+00
Timeline of the Industrial Revolution,timeline-of-the-industrial-revolution,technology,20,2026-03-13 05:29:00.676999+00
Timeline of the Ottoman Empire,timeline-of-the-ottoman-empire,history,22,2026-03-13 05:29:00.676999+00
Timeline of the Roman Republic,timeline-of-the-roman-republic,history,21,2026-03-13 05:29:00.676999+00