timeline_title,timeline_slug,category,event_count,last_updated
Timeline of the Boxer Rebellion,boxer-rebellion,history,20,2026-03-30 00:30:44.165844+00
Timeline of the Lisbon Earthquake,lisbon-earthquake,history,20,2026-03-30 00:30:44.165844+00
Timeline of Rinderpest Eradication,rinderpest-eradication,science,20,2026-03-30 00:30:44.165844+00
Timeline of the Wars of the Roses,wars-of-the-roses,history,20,2026-03-30 00:30:44.165844+00
Timeline of the Rise of Google,rise-of-google,technology,20,2026-03-30 00:30:44.165844+00
Timeline of the History of Paper,history-of-paper,technology,20,2026-03-30 00:30:44.165844+00
Timeline of the Persian Empire,persian-empire,history,20,2026-03-30 00:30:44.165844+00
Timeline of the Battle of Gettysburg,battle-of-gettysburg,war,20,2026-03-30 00:30:44.165844+00
Timeline of the Habsburg Empire,habsburg-empire,history,20,2026-03-30 00:30:44.165844+00
Timeline of the Fall of Constantinople,fall-of-constantinople,history,20,2026-03-30 00:30:44.165844+00
Timeline of the Srebrenica Massacre,srebrenica-massacre,history,20,2026-03-30 00:14:26.635949+00
Timeline of the Seljuk Empire,seljuk-empire,history,20,2026-03-30 00:14:26.635949+00
Timeline of the History of the Barcode,history-of-the-barcode,technology,20,2026-03-30 00:14:26.635949+00
Timeline of the History of the Transistor,history-of-the-transistor,technology,20,2026-03-30 00:14:26.635949+00
Timeline of the History of Anesthesia,history-of-anesthesia,science,20,2026-03-30 00:14:26.635949+00
Timeline of the Exxon Valdez Oil Spill,exxon-valdez-oil-spill,environment,20,2026-03-30 00:14:26.635949+00
Timeline of the Battle of Britain,battle-of-britain,war,20,2026-03-30 00:14:26.635949+00
Timeline of the Khmer Rouge,khmer-rouge,history,20,2026-03-30 00:14:26.635949+00
Timeline of the Velvet Revolution,velvet-revolution,politics,20,2026-03-30 00:14:26.635949+00
Timeline of the Dust Bowl,dust-bowl,history,20,2026-03-30 00:14:26.635949+00
Timeline of Spotify,spotify,business,20,2026-03-29 15:09:36.162843+00
Timeline of TikTok,tiktok,technology,20,2026-03-29 07:29:24.877568+00
Timeline of the European Central Bank,european-central-bank,finance,20,2026-03-29 07:29:24.877568+00
Timeline of Sony,sony,business,20,2026-03-29 07:29:24.877568+00
Timeline of SARS,sars,science,20,2026-03-29 07:29:24.877568+00
Timeline of the House of Saud,house-of-saud,history,20,2026-03-29 07:29:24.877568+00
Timeline of Apollo 11,apollo-11,science,20,2026-03-29 07:29:24.877568+00
Timeline of McDonald’s,mcdonalds,business,20,2026-03-29 07:29:24.877568+00
Timeline of the History of the Bicycle,history-of-the-bicycle,technology,20,2026-03-29 07:29:24.877568+00
Timeline of the Iran-Iraq War,iran-iraq-war,war,20,2026-03-29 07:29:24.877568+00
Timeline of Coca-Cola,coca-cola,business,20,2026-03-29 07:29:24.877568+00
Timeline of the History of Vaccines,history-of-vaccines,science,20,2026-03-28 20:30:02.378934+00
Timeline of the French Fifth Republic,french-fifth-republic,politics,20,2026-03-28 20:30:02.378934+00
Timeline of the History of Aviation,history-of-aviation,technology,20,2026-03-28 20:30:02.378934+00
Timeline of the Anglo-Zulu War,anglo-zulu-war,war,20,2026-03-28 20:30:02.378934+00
Timeline of the History of Photography,history-of-photography,technology,20,2026-03-28 20:30:02.378934+00
Timeline of the Manhattan Project,manhattan-project,science,39,2026-03-28 20:30:02.378934+00
Timeline of the Harlem Renaissance,harlem-renaissance,culture,34,2026-03-28 20:30:02.378934+00
Timeline of the California Gold Rush,california-gold-rush,society,41,2026-03-28 20:30:02.378934+00
Timeline of the Cuban Missile Crisis,cuban-missile-crisis,war,39,2026-03-28 20:30:02.378934+00
Timeline of the Meiji Restoration,meiji-restoration,politics,40,2026-03-28 20:30:02.378934+00
Timeline of the Rise of Amazon,rise-of-amazon,business,20,2026-03-28 16:37:20.523318+00
Timeline of the Great Fire of London,great-fire-of-london,history,20,2026-03-28 16:37:20.523318+00
Timeline of Bitcoin,bitcoin,finance,20,2026-03-28 16:37:20.523318+00
Timeline of the Treaty of Versailles,treaty-of-versailles,history,20,2026-03-28 16:37:20.523318+00
Timeline of OPEC,opec,politics,20,2026-03-28 16:37:20.523318+00
Timeline of the History of Pizza,history-of-pizza,culture,20,2026-03-28 16:37:20.523318+00
Timeline of the Rwandan Genocide,rwandan-genocide,history,20,2026-03-28 16:37:20.523318+00
Timeline of the Romanovs,romanovs,history,20,2026-03-28 16:37:20.523318+00
Timeline of Airbnb,airbnb,business,20,2026-03-28 16:37:20.523318+00
Timeline of Formula One,formula-one,sport,20,2026-03-28 16:37:20.523318+00
Timeline of the Alaska Purchase,alaska-purchase,history,20,2026-03-28 15:32:44.472962+00
Timeline of the Boer War,boer-war,war,20,2026-03-28 15:32:44.472962+00
Timeline of the Battle of Waterloo,battle-of-waterloo,war,20,2026-03-28 15:32:44.472962+00
Timeline of the History of Chocolate,history-of-chocolate,culture,20,2026-03-28 15:32:44.472962+00
Timeline of the Wright Brothers,wright-brothers,technology,20,2026-03-28 15:32:44.472962+00
Timeline of the Fall of the Soviet Union,fall-of-the-soviet-union,politics,20,2026-03-28 15:32:44.472962+00
Timeline of the Ming Treasure Voyages,ming-treasure-voyages,history,20,2026-03-28 15:32:44.472962+00
Timeline of the History of Television,history-of-television,culture,20,2026-03-28 15:32:44.472962+00
Timeline of the Semiconductor Industry,semiconductor-industry,technology,20,2026-03-28 15:32:44.472962+00
Timeline of the Suez Canal,suez-canal,history,20,2026-03-28 15:32:44.472962+00
Timeline of Penicillin,penicillin,science,20,2026-03-28 14:05:41.563223+00
Timeline of the History of the Microprocessor,history-of-the-microprocessor,technology,20,2026-03-28 14:05:41.563223+00
Timeline of Container Shipping,container-shipping,technology,20,2026-03-28 14:05:41.563223+00
Timeline of the Walt Disney Company,walt-disney-company,business,20,2026-03-28 14:05:41.563223+00
Timeline of the Hubble Space Telescope,hubble-space-telescope,science,20,2026-03-28 14:05:41.563223+00
Timeline of the History of Plastic,history-of-plastic,science,20,2026-03-28 14:05:41.563223+00
Timeline of the History of Fast Food,history-of-fast-food,culture,20,2026-03-28 14:05:41.563223+00
Timeline of the Non-Aligned Movement,non-aligned-movement,politics,20,2026-03-28 14:05:41.563223+00
Timeline of Mount Everest Exploration,mount-everest-exploration,history,20,2026-03-28 14:05:41.563223+00
Timeline of Nintendo,nintendo,technology,20,2026-03-28 14:05:41.563223+00
Timeline of the History of Barbie,history-of-barbie,culture,20,2026-03-27 18:57:46.687933+00
Timeline of the RMS Lusitania,rms-lusitania,history,20,2026-03-27 18:57:46.687933+00
Timeline of the Dot-com Crash,dot-com-crash,finance,20,2026-03-27 18:57:46.687933+00
Timeline of BlackBerry,blackberry,business,20,2026-03-27 18:57:46.687933+00
Timeline of Polio Eradication,polio-eradication,science,20,2026-03-27 18:57:46.687933+00
Timeline of the Punic Wars,punic-wars,war,20,2026-03-27 18:57:46.687933+00
Timeline of the Salem Witch Trials,salem-witch-trials,history,20,2026-03-27 18:57:46.687933+00
Timeline of the Bessemer Process,bessemer-process,technology,20,2026-03-27 18:57:46.687933+00
Timeline of the Berlin Airlift,berlin-airlift,history,20,2026-03-27 18:57:46.687933+00
Timeline of the 2008 Financial Crisis,2008-financial-crisis,finance,20,2026-03-27 18:57:46.687933+00
Timeline of the Rise of Elon Musk’s Companies,rise-of-elon-musk-companies,technology,20,2026-03-27 13:57:20.308584+00
Timeline of Kodak’s Rise and Collapse,kodak-rise-and-collapse,business,20,2026-03-27 13:57:20.308584+00
Timeline of the Transcontinental Railroad,transcontinental-railroad,technology,38,2026-03-27 13:57:20.308584+00
Timeline of the Search for the Northwest Passage,search-for-the-northwest-passage,history,37,2026-03-27 13:57:20.308584+00
Timeline of the Third Plague Pandemic,third-plague-pandemic,science,35,2026-03-27 13:57:20.308584+00
Timeline of the Dutch East India Company,dutch-east-india-company,history,36,2026-03-27 13:57:20.308584+00
Timeline of LEGO,lego,culture,33,2026-03-27 13:57:20.308584+00
Timeline of the History of Reality Television,history-of-reality-television,culture,33,2026-03-27 13:57:20.308584+00
Timeline of the Concorde,concorde,technology,35,2026-03-27 13:57:20.308584+00
Timeline of How Dubai Became Dubai,how-dubai-became-dubai,history,32,2026-03-27 13:57:20.308584+00
Timeline of the Rise of Elon Musk's Companies,rise-of-elon-musks-companies,business,20,2026-03-27 13:35:19.592275+00
Timeline of Kodak's Rise and Collapse,kodaks-rise-and-collapse,business,20,2026-03-27 13:35:19.592275+00
Timeline of the History of UFO Sightings,history-of-ufo-sightings,society,20,2026-03-27 06:16:52.306373+00
Timeline of the History of the Sandwich,history-of-the-sandwich,culture,20,2026-03-27 06:16:52.306373+00
Timeline of the Loch Ness Monster Phenomenon,loch-ness-monster-phenomenon,culture,20,2026-03-27 06:16:52.306373+00
Timeline of the History of the Mustache,history-of-the-mustache,society,20,2026-03-27 06:16:52.306373+00
Timeline of Competitive Eating,competitive-eating,culture,20,2026-03-27 06:16:52.306373+00
Timeline of the History of Ice Cream,history-of-ice-cream,culture,20,2026-03-27 06:16:52.306373+00
Timeline of the History of Underwear,history-of-underwear,society,20,2026-03-27 06:16:52.306373+00
Timeline of Pigeons in Human History,pigeons-in-human-history,history,20,2026-03-27 06:16:52.306373+00
Timeline of Vending Machines,vending-machines,technology,20,2026-03-27 06:16:52.306373+00
Timeline of the Eurovision Song Contest,eurovision-song-contest,culture,20,2026-03-27 06:16:52.306373+00
Timeline of the Mexican Revolution,mexican-revolution,politics,20,2026-03-26 21:13:29.668671+00
Timeline of Romanticism,romanticism,culture,20,2026-03-26 21:13:29.668671+00
Timeline of the War of 1812,war-of-1812,war,20,2026-03-26 21:13:29.668671+00
Timeline of the Phoenicians,phoenicians,history,20,2026-03-26 21:13:29.668671+00
Timeline of the Ottoman Tanzimat Reforms,ottoman-tanzimat-reforms,politics,22,2026-03-26 21:13:29.668671+00
Timeline of Human Spaceflight,human-spaceflight,technology,22,2026-03-26 21:13:29.668671+00
Timeline of Central Banking,central-banking,finance,22,2026-03-26 21:13:29.668671+00
Timeline of Typography,typography,culture,22,2026-03-26 21:13:29.668671+00
Timeline of Smallpox Eradication,smallpox-eradication,science,20,2026-03-26 21:13:29.668671+00
Timeline of the Berlin Wall,berlin-wall,politics,22,2026-03-26 21:13:29.668671+00
Timeline of Book Censorship,book-censorship,society,20,2026-03-26 11:47:03.16398+00
Timeline of the History of the Telegraph,history-of-the-telegraph,technology,20,2026-03-26 11:47:03.16398+00
Timeline of the Rise of Fascism in Italy,rise-of-fascism-in-italy,politics,21,2026-03-26 11:47:03.16398+00
Timeline of the Battle of Stalingrad,battle-of-stalingrad,war,20,2026-03-26 11:47:03.16398+00
Timeline of the History of Genetics,history-of-genetics,science,21,2026-03-26 11:47:03.16398+00
Timeline of the Suez Crisis,suez-crisis,politics,20,2026-03-26 11:47:03.16398+00
Timeline of the Abbasid Caliphate,abbasid-caliphate,history,20,2026-03-26 11:47:03.16398+00
Timeline of the Haitian Revolution,haitian-revolution,history,22,2026-03-26 11:47:03.16398+00
Timeline of the World Wide Web,world-wide-web,technology,21,2026-03-26 11:47:03.16398+00
Timeline of the Byzantine Empire,byzantine-empire,history,29,2026-03-26 11:47:03.16398+00
Timeline of the Bronze Age Collapse,bronze-age-collapse,history,20,2026-03-26 09:05:47.407154+00
Timeline of the Crimean War,crimean-war,war,20,2026-03-26 09:05:47.407154+00
Timeline of the Han Dynasty,han-dynasty,history,30,2026-03-26 09:05:47.407154+00
Timeline of the 1973 Oil Crisis,1973-oil-crisis,economy,39,2026-03-26 09:05:47.407154+00
Timeline of the Discovery and Development of Insulin,discovery-and-development-of-insulin,science,31,2026-03-26 09:05:47.407154+00
Timeline of the History of Chess,history-of-chess,culture,34,2026-03-26 09:05:47.407154+00
Timeline of the History of Universities,history-of-universities,education,34,2026-03-26 09:05:47.407154+00
Timeline of the Persian Gulf War,persian-gulf-war,war,35,2026-03-26 09:05:47.407154+00
Timeline of the Seven Years' War,seven-years-war,war,28,2026-03-26 09:05:47.407154+00
Timeline of the Kingdom of Kush,kingdom-of-kush,history,38,2026-03-26 09:05:47.407154+00
Timeline of the Chernobyl Disaster,chernobyl-disaster,disaster,20,2026-03-26 07:43:32.588948+00
Timeline of the History of Coffee,history-of-coffee,culture,20,2026-03-26 07:43:32.588948+00
Timeline of the History of Antibiotics,history-of-antibiotics,science,20,2026-03-26 07:43:32.588948+00
Timeline of the European Union,european-union,politics,20,2026-03-26 07:43:32.588948+00
Timeline of the Korean War,korean-war,war,20,2026-03-26 07:43:32.588948+00
Timeline of the History of Computing,history-of-computing,technology,20,2026-03-26 07:43:32.588948+00
Timeline of Sumerian City-States,sumerian-city-states,history,20,2026-03-25 22:37:16.547807+00
Timeline of the International Abolition of the Slave Trade,international-abolition-of-the-slave-trade,society,20,2026-03-25 22:37:16.547807+00
Timeline of the Seleucid Empire,seleucid-empire,history,20,2026-03-25 22:37:16.547807+00
Timeline of Hollywood,hollywood,culture,21,2026-03-24 09:05:08.392086+00
Timeline of Copyright and Intellectual Property,copyright-and-intellectual-property,society,21,2026-03-24 09:05:08.392086+00
Timeline of Wall Street and the New York Stock Exchange,wall-street-new-york-stock-exchange,finance,21,2026-03-24 09:05:08.392086+00
Timeline of Internet Governance,internet-governance,technology,20,2026-03-24 09:05:08.392086+00
Timeline of Antibiotic Resistance,antibiotic-resistance,science,21,2026-03-24 09:05:08.392086+00
Timeline of the History of Archaeology,history-of-archaeology,science,22,2026-03-24 09:05:08.392086+00
Timeline of the Mamluk Sultanate,mamluk-sultanate,history,21,2026-03-24 09:05:08.392086+00
Timeline of the Tokugawa Shogunate,tokugawa-shogunate,history,20,2026-03-24 09:05:08.392086+00
Timeline of the Vikings,vikings,history,20,2026-03-24 09:05:08.392086+00
Timeline of the British Empire,british-empire,history,23,2026-03-24 09:05:08.392086+00
Timeline of the Hanseatic League,hanseatic-league,history,20,2026-03-24 07:04:50.361883+00
Timeline of the Bourbon Dynasty in France,bourbon-dynasty-in-france,politics,20,2026-03-24 07:04:50.361883+00
Timeline of the Achaemenid Empire,achaemenid-empire,history,20,2026-03-24 07:04:50.361883+00
Timeline of the History of Radio,history-of-radio,technology,20,2026-03-24 07:04:50.361883+00
Timeline of the Taiping Rebellion,taiping-rebellion,war,20,2026-03-24 07:04:50.361883+00
Timeline of the Space Shuttle Program,space-shuttle-program,technology,20,2026-03-24 07:04:50.361883+00
Timeline of the Federal Reserve System,federal-reserve-system,finance,42,2026-03-24 07:04:50.361883+00
Timeline of the Academy Awards,academy-awards,culture,41,2026-03-24 07:04:50.361883+00
Timeline of the Gupta Empire,gupta-empire,history,41,2026-03-24 07:04:50.361883+00
Timeline of the Romanov Dynasty,romanov-dynasty,history,37,2026-03-24 07:04:50.361883+00
Timeline of the Periodic Table,periodic-table,science,22,2026-03-24 06:22:00.393309+00
Timeline of the Bosnian War and the Breakup of Yugoslavia,bosnian-war-and-breakup-of-yugoslavia,war,22,2026-03-24 06:22:00.393309+00
Timeline of the History of Submarine Cables,history-of-submarine-cables,technology,22,2026-03-24 06:22:00.393309+00
Timeline of the Medici Family and Renaissance Florence,medici-family-and-renaissance-florence,culture,22,2026-03-24 06:22:00.393309+00
Timeline of the History of Surgery,history-of-surgery,science,22,2026-03-24 06:22:00.393309+00
Timeline of the Cuban Revolution and Communist Cuba,cuban-revolution-and-communist-cuba,politics,23,2026-03-24 06:22:00.393309+00
Timeline of the Green Revolution,green-revolution,science,20,2026-03-24 05:20:44.786636+00
Timeline of the History of Animation,history-of-animation,culture,20,2026-03-24 05:20:44.786636+00
Timeline of the French Colonial Empire,french-colonial-empire,history,21,2026-03-24 05:20:44.786636+00
Timeline of Mao Zedong and the Chinese Revolution,mao-zedong-and-the-chinese-revolution,politics,21,2026-03-24 05:20:44.786636+00
Timeline of the Steam Engine and Steam Power,steam-engine-and-steam-power,technology,21,2026-03-24 05:20:44.786636+00
Timeline of the Habsburg Monarchy,habsburg-monarchy,history,21,2026-03-24 05:20:44.786636+00
History of Facebook,facebook,technology,20,2026-03-24 05:20:44.786636+00
Timeline of the Islamic Golden Age,islamic-golden-age,history,20,2026-03-24 05:20:44.786636+00
Timeline of the League of Nations,league-of-nations,politics,21,2026-03-24 05:20:44.786636+00
Timeline of NASA,nasa,science,21,2026-03-24 05:20:44.786636+00
Timeline of the Safavid Empire,safavid-empire,history,24,2026-03-23 07:55:44.664085+00
Timeline of the International Monetary Fund,international-monetary-fund,finance,21,2026-03-23 07:55:44.664085+00
Timeline of the World Bank,world-bank,finance,20,2026-03-23 07:55:44.664085+00
History of Apple Inc.,history-of-apple-inc,technology,21,2026-03-23 07:55:44.664085+00
History of Microsoft,history-of-microsoft,technology,20,2026-03-23 07:55:44.664085+00
Timeline of the Discovery of DNA,discovery-of-dna,science,23,2026-03-23 07:55:44.664085+00
Timeline of the Treaty of Versailles and Its Aftermath,treaty-of-versailles-and-its-aftermath,politics,21,2026-03-23 07:55:44.664085+00
Timeline of the Troubles in Northern Ireland,troubles-in-northern-ireland,politics,22,2026-03-23 07:55:44.664085+00
Timeline of the Opium Wars,opium-wars,war,21,2026-03-23 07:55:44.664085+00
Timeline of the Enlightenment,enlightenment,history,21,2026-03-23 07:55:44.664085+00
Timeline of the European Space Agency,european-space-agency,science,22,2026-03-22 13:58:04.770889+00
Timeline of the History of Cybersecurity,history-of-cybersecurity,technology,20,2026-03-22 13:58:04.770889+00
Timeline of the Gold Standard,gold-standard,finance,21,2026-03-22 13:58:04.770889+00
Timeline of the Beat Generation,beat-generation,literature,20,2026-03-22 13:58:04.770889+00
Timeline of the History of E-commerce,history-of-e-commerce,technology,20,2026-03-22 13:58:04.770889+00
Timeline of the Human Microbiome in Science and Medicine,human-microbiome-in-science-and-medicine,science,20,2026-03-22 13:58:04.770889+00
Timeline of the Rosetta Stone and the Decipherment of Egyptian Hieroglyphs,rosetta-stone-and-the-decipherment-of-egyptian-hieroglyphs,history,21,2026-03-22 13:58:04.770889+00
Timeline of North Korea's Nuclear Program,north-korea-nuclear-program,politics,20,2026-03-22 13:58:04.770889+00
Timeline of the Klondike Gold Rush,klondike-gold-rush,history,20,2026-03-22 13:58:04.770889+00
Timeline of the Black Lives Matter Movement,black-lives-matter-movement,society,20,2026-03-22 13:58:04.770889+00
Timeline of the World Health Organization,world-health-organization,health,20,2026-03-22 09:34:29.550393+00
Timeline of Surrealism,surrealism,culture,20,2026-03-22 09:34:29.550393+00
Timeline of the Spanish Civil War,spanish-civil-war,war,20,2026-03-22 09:34:29.550393+00
Timeline of the Russian Revolution,russian-revolution,politics,20,2026-03-22 09:34:29.550393+00
Timeline of the Panama Canal,panama-canal,history,20,2026-03-22 09:34:29.550393+00
History of Google,google,technology,20,2026-03-22 09:34:29.550393+00
Timeline of the Euro,euro,finance,20,2026-03-22 09:34:29.550393+00
Timeline of the Berlin Wall and German Reunification,berlin-wall-and-german-reunification,politics,20,2026-03-22 09:34:29.550393+00
History of Amazon,amazon,technology,20,2026-03-22 09:34:29.550393+00
Timeline of Product Failures,product-failures,technology,20,2026-03-21 09:39:49.67857+00
Timeline of Scientific Frauds,scientific-frauds,science,20,2026-03-21 09:39:49.67857+00
Timeline of Mass Hysteria,mass-hysteria,society,20,2026-03-21 09:39:49.67857+00
Timeline of Failed Assassinations,failed-assassinations,politics,18,2026-03-21 09:39:49.67857+00
Timeline of Royal Scandals,royal-scandals,politics,20,2026-03-21 09:39:49.67857+00
Timeline of Financial Bubbles,financial-bubbles,finance,20,2026-03-21 09:39:49.67857+00
Timeline of Prison Escapes,prison-escapes,crime,20,2026-03-21 09:39:49.67857+00
Timeline of Banned Books,banned-books,literature,20,2026-03-21 09:39:49.67857+00
Timeline of Famous Hoaxes,famous-hoaxes,culture,20,2026-03-21 09:39:49.67857+00
Timeline of Great Impostors,great-impostors,society,20,2026-03-21 09:39:49.67857+00
Timeline of the World Trade Organization,world-trade-organization,finance,21,2026-03-18 18:49:36.34166+00
Timeline of the United States Constitution,united-states-constitution,politics,26,2026-03-18 18:49:36.34166+00
Timeline of International Humanitarian Law,international-humanitarian-law,politics,21,2026-03-18 18:49:36.34166+00
Timeline of the Beatles,beatles,culture,25,2026-03-18 18:49:36.34166+00
Timeline of the Atlantic Slave Trade,atlantic-slave-trade,society,20,2026-03-18 18:49:36.34166+00
Timeline of Nuclear Energy,nuclear-energy,technology,24,2026-03-18 18:49:36.34166+00
Timeline of Genomics,genomics,science,23,2026-03-18 18:49:36.34166+00
Timeline of the Apollo Program,apollo-program,science,24,2026-03-18 18:49:36.34166+00
Timeline of Nazi Germany,nazi-germany,politics,25,2026-03-18 18:49:36.34166+00
Timeline of the Mughal Empire,mughal-empire,history,23,2026-03-18 18:49:36.34166+00
Timeline of Biometrics,biometrics,technology,20,2026-03-18 17:09:49.2965+00
Timeline of Packaging,packaging,technology,18,2026-03-18 17:09:49.2965+00
Timeline of Lenses and Optics,lenses-and-optics,science,20,2026-03-18 17:09:49.2965+00
Timeline of Salting and Food Preservation,salting-and-food-preservation,food,19,2026-03-18 17:09:49.2965+00
Timeline of Pigments and Dyes,pigments-and-dyes,science,19,2026-03-18 17:09:49.2965+00
Timeline of Meetings,meetings,society,19,2026-03-18 17:09:49.2965+00
Timeline of Toys and Play,toys-and-play,culture,20,2026-03-18 17:09:49.2965+00
Timeline of Applause,applause,culture,20,2026-03-18 17:09:49.2965+00
Timeline of the Signature,signature,society,19,2026-03-18 17:09:49.2965+00
Timeline of Weeds and Lawns,weeds-and-lawns,society,20,2026-03-18 17:09:49.2965+00
Timeline of Weather Forecasting,weather-forecasting,science,20,2026-03-17 11:17:59.804756+00
Timeline of Prosthetics,prosthetics,science,20,2026-03-17 11:17:59.804756+00
Timeline of Insurance,insurance,finance,20,2026-03-17 11:17:59.804756+00
Timeline of Passports,passports,politics,20,2026-03-17 11:17:59.804756+00
Timeline of Sewage,sewage,society,20,2026-03-17 11:17:59.804756+00
Timeline of Concrete,concrete,technology,20,2026-03-17 11:17:59.804756+00
Timeline of Surveillance,surveillance,politics,20,2026-03-17 11:17:59.804756+00
Timeline of Refrigeration,refrigeration,technology,20,2026-03-17 11:17:59.804756+00
Timeline of Cartography,cartography,geography,20,2026-03-17 11:17:59.804756+00
Timeline of Measurement,measurement,science,20,2026-03-17 11:17:59.804756+00
Timeline of Sanctions on Iran,sanctions-on-iran,politics,20,2026-03-16 07:35:21.22248+00
Timeline of Drone Warfare,drone-warfare,war,20,2026-03-16 07:35:21.22248+00
Timeline of OPEC and OPEC+,opec-and-opec-plus,finance,20,2026-03-16 07:35:21.22248+00
Timeline of the Red Sea Shipping Crisis,red-sea-shipping-crisis,society,20,2026-03-16 07:35:21.22248+00
Timeline of the South China Sea Disputes,south-china-sea-disputes,politics,20,2026-03-16 07:35:21.22248+00
Timeline of Hypersonic Weapons,hypersonic-weapons,technology,20,2026-03-16 07:35:21.22248+00
Timeline of Ballistic Missile Development,ballistic-missile-development,technology,20,2026-03-16 07:35:21.22248+00
Timeline of Iran–Israel Conflict,iran-israel-conflict,politics,20,2026-03-16 07:35:21.22248+00
Timeline of Global Oil Crises,global-oil-crises,finance,20,2026-03-16 07:35:21.22248+00
Timeline of the Strait of Hormuz,strait-of-hormuz,geopolitics,20,2026-03-16 07:35:21.22248+00
Timeline of Night and Light,night-and-light,technology,20,2026-03-15 21:49:20.424719+00
Timeline of Waste,waste,environment,20,2026-03-15 21:49:20.424719+00
Timeline of Sugar,sugar,society,20,2026-03-15 21:49:20.424719+00
Timeline of Extinction,extinction,environment,20,2026-03-15 21:49:20.424719+00
Timeline of Pets,pets,society,20,2026-03-15 21:49:20.424719+00
Timeline of Gardens,gardens,culture,20,2026-03-15 21:49:20.424719+00
Timeline of Archives and Record-Keeping,archives-and-record-keeping,history,20,2026-03-15 21:49:20.424719+00
Timeline of Propaganda,propaganda,media,20,2026-03-15 21:49:20.424719+00
Timeline of Mathematics,mathematics,science,20,2026-03-15 21:49:20.424719+00
Timeline of Money,money,finance,20,2026-03-15 21:49:20.424719+00
Timeline of Wayfinding and Navigation,wayfinding-and-navigation,science,20,2026-03-15 20:02:49.251235+00
Timeline of Clothing Technology,clothing-technology,culture,20,2026-03-15 20:02:49.251235+00
Timeline of the Key,history-of-locks-and-keys,technology,20,2026-03-15 20:02:49.251235+00
Timeline of Paper,paper-material-history,technology,20,2026-03-15 20:02:49.251235+00
Timeline of the Chair,chair-design-history,culture,20,2026-03-15 20:02:49.251235+00
Timeline of Glass,glass-material-history,technology,20,2026-03-15 20:02:49.251235+00
Timeline of Waiting,history-of-waiting,society,20,2026-03-15 20:02:49.251235+00
Timeline of Cleanliness and Hygiene,cleanliness-and-hygiene,science,20,2026-03-15 20:02:49.251235+00
Timeline of Measured Speed,measured-speed,technology,20,2026-03-15 20:02:49.251235+00
Timeline of Domestic Privacy,domestic-privacy,society,20,2026-03-15 20:02:49.251235+00
Timeline of Cold,cold,technology,24,2026-03-15 19:14:07.781697+00
Timeline of Thinking Machines,thinking-machines,science,24,2026-03-15 19:14:07.781697+00
Timeline of the Speed of Travel,speed-of-travel,technology,24,2026-03-15 19:14:07.781697+00
Timeline of the Death of Technologies,death-of-technologies,technology,23,2026-03-15 19:14:07.781697+00
